{
  "schema_version": "shirube-waiver/v1",
  "WAIVER-ID": "WAIVER-ADF-452-D-EXPIRED",
  "target_cell": "CELL-ADF-452-D",
  "target_check": "script-gate",
  "reason": "Expired fixture waiver.",
  "risk_accepted": "Temporary fixture risk.",
  "compensating_controls": ["Manual owner review before merge."],
  "approver": "release_owner",
  "expiry_date": "2020-01-01",
  "follow_up_issue": "https://github.com/watchout/ai-dev-framework/issues/452",
  "status": "expired"
}
