{
  "schema_version": "shirube-waiver/v1",
  "WAIVER-ID": "WAIVER-ADF-452-D-VALID",
  "target_cell": "CELL-ADF-452-D",
  "target_check": "script-gate",
  "reason": "Fixture waiver for a skipped report-only check.",
  "risk_accepted": "Temporary fixture risk.",
  "compensating_controls": ["Manual owner review before merge."],
  "approver": "release_owner",
  "expiry_date": "2099-01-01",
  "follow_up_issue": "https://github.com/watchout/ai-dev-framework/issues/452",
  "status": "active"
}
